{
  "admin_labels": [],
  "amendments": [],
  "branch": "fix/issue-1367-1370/scheduler-emit-normalize",
  "changed_test_paths": [],
  "check_results": [],
  "commit": null,
  "docs_landing": {},
  "full_audit": null,
  "governance_touch": true,
  "issues": [
    {
      "close_in_pr": true,
      "followup_rationale": null,
      "number": 1367,
      "url": "https://github.com/zjzcpj/SciStudio/issues/1367"
    },
    {
      "close_in_pr": true,
      "followup_rationale": null,
      "number": 1370,
      "url": "https://github.com/zjzcpj/SciStudio/issues/1370"
    }
  ],
  "owner_directive": "Root-cause: BLOCK_READY emission on resume/rerun/reset + interactive normalize_outputs",
  "planned_files": [],
  "pull_request": null,
  "record_path": ".workflow/records/1367-1370-scheduler-emit-normalize.json",
  "required_checks": [],
  "schema_version": "1",
  "scope": {
    "exclude": [],
    "include": [
      "src/scistudio/engine/scheduler.py",
      "tests/engine/test_scheduler.py",
      "tests/engine/test_scheduler_interactive.py",
      "CHANGELOG.md",
      "docs/planning/2026-05-21-bug-sweep-checklist.md",
      ".workflow/records/1367-1370-scheduler-emit-normalize.json"
    ]
  },
  "sentrux": null,
  "stages": [
    {
      "completed_at": null,
      "stage": "scope_and_issue",
      "status": "done",
      "summary": null
    },
    {
      "completed_at": null,
      "stage": "plan",
      "status": "pending",
      "summary": null
    },
    {
      "completed_at": null,
      "stage": "implement",
      "status": "pending",
      "summary": null
    },
    {
      "completed_at": null,
      "stage": "update_docs",
      "status": "pending",
      "summary": null
    },
    {
      "completed_at": null,
      "stage": "test_and_checks",
      "status": "pending",
      "summary": null
    },
    {
      "completed_at": null,
      "stage": "commit_and_submit_pr",
      "status": "pending",
      "summary": null
    }
  ],
  "task_id": "1367-scheduler-emit-normalize",
  "task_kind": "bugfix"
}
